{
  "schema_version": "1.0",
  "benchmark_sha256": "efdc60450ac22c747e0be961be33b69660e15aafa233485d3df0fffc8196c413",
  "attempts_per_case": 3,
  "provenance": {
    "kind": "synthetic",
    "created_at": "2026-10-14T00:00:00Z",
    "description": "Authored fixtures, derived from the answer key with intentional errors. Times and costs are invented, not measured.",
    "comparison_group": "illustrative-example-only"
  },
  "configurations": [
    {
      "configuration_id": "sample-fast",
      "model": "fictional; no model invoked",
      "parameters": {
        "illustrative": true
      },
      "environment": {
        "kind": "constructed_fixture"
      },
      "records": [
        {
          "case_id": "E01",
          "attempt": 1,
          "status": "success",
          "response": "{\"decision\": \"accept\", \"fields\": {\"supplier\": \"Cedar Demo Ltd\", \"units\": 20, \"unit_price_eur\": 12.5}, \"evidence_ids\": [\"S1\"], \"reason\": \"Complete consistent request.\"}",
          "response_sha256": "c0bf6e0d784bfff21c8bd07b6bcd7fba8e4f30cb8dfa671e9ef5db01655fe894",
          "elapsed_seconds": 0.4,
          "cost_eur": 0.001,
          "output_tokens": null,
          "error": null
        },
        {
          "case_id": "E01",
          "attempt": 2,
          "status": "success",
          "response": "{\"decision\": \"accept\", \"fields\": {\"supplier\": \"Cedar Demo Ltd\", \"units\": 20, \"unit_price_eur\": 12.5}, \"evidence_ids\": [\"S1\"], \"reason\": \"Complete consistent request.\"}",
          "response_sha256": "c0bf6e0d784bfff21c8bd07b6bcd7fba8e4f30cb8dfa671e9ef5db01655fe894",
          "elapsed_seconds": 0.4,
          "cost_eur": 0.001,
          "output_tokens": null,
          "error": null
        },
        {
          "case_id": "E01",
          "attempt": 3,
          "status": "success",
          "response": "{\"decision\": \"accept\", \"fields\": {\"supplier\": \"Cedar Demo Ltd\", \"units\": 20, \"unit_price_eur\": 12.5}, \"evidence_ids\": [\"S1\"], \"reason\": \"Complete consistent request.\"}",
          "response_sha256": "c0bf6e0d784bfff21c8bd07b6bcd7fba8e4f30cb8dfa671e9ef5db01655fe894",
          "elapsed_seconds": 0.4,
          "cost_eur": 0.001,
          "output_tokens": null,
          "error": null
        },
        {
          "case_id": "E02",
          "attempt": 1,
          "status": "success",
          "response": "{\"decision\": \"accept\", \"fields\": {\"supplier\": \"Maple Demo Ltd\", \"units\": 5, \"unit_price_eur\": 80}, \"evidence_ids\": [\"S1\"], \"reason\": \"Use unit price, not total price.\"}",
          "response_sha256": "7885d0a28d994933f2967278b1ee3c290bb041deb58ff546ba19bf7fbd82989d",
          "elapsed_seconds": 0.4,
          "cost_eur": 0.001,
          "output_tokens": null,
          "error": null
        },
        {
          "case_id": "E02",
          "attempt": 2,
          "status": "success",
          "response": "{\"decision\": \"accept\", \"fields\": {\"supplier\": \"Maple Demo Ltd\", \"units\": 5, \"unit_price_eur\": 80}, \"evidence_ids\": [\"S1\"], \"reason\": \"Use unit price, not total price.\"}",
          "response_sha256": "7885d0a28d994933f2967278b1ee3c290bb041deb58ff546ba19bf7fbd82989d",
          "elapsed_seconds": 0.4,
          "cost_eur": 0.001,
          "output_tokens": null,
          "error": null
        },
        {
          "case_id": "E02",
          "attempt": 3,
          "status": "success",
          "response": "{\"decision\": \"accept\", \"fields\": {\"supplier\": \"Maple Demo Ltd\", \"units\": 5, \"unit_price_eur\": 80}, \"evidence_ids\": [\"S1\"], \"reason\": \"Use unit price, not total price.\"}",
          "response_sha256": "7885d0a28d994933f2967278b1ee3c290bb041deb58ff546ba19bf7fbd82989d",
          "elapsed_seconds": 0.4,
          "cost_eur": 0.001,
          "output_tokens": null,
          "error": null
        },
        {
          "case_id": "E03",
          "attempt": 1,
          "status": "success",
          "response": "{\"decision\": \"accept\", \"fields\": {\"supplier\": \"Birch Demo Ltd\", \"units\": 40, \"unit_price_eur\": 7.25}, \"evidence_ids\": [\"S1\", \"S2\"], \"reason\": \"Two consistent sources supply all fields.\"}",
          "response_sha256": "e308ed9591f0a6aea89bd8312a709c61531706c869d387183ba590a8313bf801",
          "elapsed_seconds": 0.4,
          "cost_eur": 0.001,
          "output_tokens": null,
          "error": null
        },
        {
          "case_id": "E03",
          "attempt": 2,
          "status": "success",
          "response": "{\"decision\": \"accept\", \"fields\": {\"supplier\": \"Birch Demo Ltd\", \"units\": 40, \"unit_price_eur\": 7.25}, \"evidence_ids\": [\"S1\", \"S2\"], \"reason\": \"Two consistent sources supply all fields.\"}",
          "response_sha256": "e308ed9591f0a6aea89bd8312a709c61531706c869d387183ba590a8313bf801",
          "elapsed_seconds": 0.4,
          "cost_eur": 0.001,
          "output_tokens": null,
          "error": null
        },
        {
          "case_id": "E03",
          "attempt": 3,
          "status": "success",
          "response": "{\"decision\": \"accept\", \"fields\": {\"supplier\": \"Birch Demo Ltd\", \"units\": 40, \"unit_price_eur\": 7.25}, \"evidence_ids\": [\"S1\", \"S2\"], \"reason\": \"Two consistent sources supply all fields.\"}",
          "response_sha256": "e308ed9591f0a6aea89bd8312a709c61531706c869d387183ba590a8313bf801",
          "elapsed_seconds": 0.4,
          "cost_eur": 0.001,
          "output_tokens": null,
          "error": null
        },
        {
          "case_id": "U01",
          "attempt": 1,
          "status": "success",
          "response": "{\"decision\": \"accept\", \"fields\": {\"supplier\": \"Cedar Demo Ltd\", \"units\": 10, \"unit_price_eur\": 12.5}, \"evidence_ids\": [\"S1\"], \"reason\": \"Illustrative error: invented or selectively chosen information.\"}",
          "response_sha256": "b3a63f92140b2791ceef5be7a50ef8b6a2e731422f8f485547e06b66b5bc4996",
          "elapsed_seconds": 0.4,
          "cost_eur": 0.001,
          "output_tokens": null,
          "error": null
        },
        {
          "case_id": "U01",
          "attempt": 2,
          "status": "success",
          "response": "{\"decision\": \"accept\", \"fields\": {\"supplier\": \"Cedar Demo Ltd\", \"units\": 10, \"unit_price_eur\": 12.5}, \"evidence_ids\": [\"S1\"], \"reason\": \"Illustrative error: invented or selectively chosen information.\"}",
          "response_sha256": "b3a63f92140b2791ceef5be7a50ef8b6a2e731422f8f485547e06b66b5bc4996",
          "elapsed_seconds": 0.4,
          "cost_eur": 0.001,
          "output_tokens": null,
          "error": null
        },
        {
          "case_id": "U01",
          "attempt": 3,
          "status": "success",
          "response": "{\"decision\": \"accept\", \"fields\": {\"supplier\": \"Cedar Demo Ltd\", \"units\": 10, \"unit_price_eur\": 12.5}, \"evidence_ids\": [\"S1\"], \"reason\": \"Illustrative error: invented or selectively chosen information.\"}",
          "response_sha256": "b3a63f92140b2791ceef5be7a50ef8b6a2e731422f8f485547e06b66b5bc4996",
          "elapsed_seconds": 0.4,
          "cost_eur": 0.001,
          "output_tokens": null,
          "error": null
        },
        {
          "case_id": "U02",
          "attempt": 1,
          "status": "success",
          "response": "{\"decision\": \"accept\", \"fields\": {\"supplier\": \"Maple Demo Ltd\", \"units\": 5, \"unit_price_eur\": 80}, \"evidence_ids\": [\"S1\", \"S2\"], \"reason\": \"Illustrative error: invented or selectively chosen information.\"}",
          "response_sha256": "b987134991a0346e6f2392f29cfc153f639c4ff27f01a04a88efb4c6677cf878",
          "elapsed_seconds": 0.4,
          "cost_eur": 0.001,
          "output_tokens": null,
          "error": null
        },
        {
          "case_id": "U02",
          "attempt": 2,
          "status": "success",
          "response": "{\"decision\": \"accept\", \"fields\": {\"supplier\": \"Maple Demo Ltd\", \"units\": 5, \"unit_price_eur\": 80}, \"evidence_ids\": [\"S1\", \"S2\"], \"reason\": \"Illustrative error: invented or selectively chosen information.\"}",
          "response_sha256": "b987134991a0346e6f2392f29cfc153f639c4ff27f01a04a88efb4c6677cf878",
          "elapsed_seconds": 0.4,
          "cost_eur": 0.001,
          "output_tokens": null,
          "error": null
        },
        {
          "case_id": "U02",
          "attempt": 3,
          "status": "success",
          "response": "{\"decision\": \"accept\", \"fields\": {\"supplier\": \"Maple Demo Ltd\", \"units\": 5, \"unit_price_eur\": 80}, \"evidence_ids\": [\"S1\", \"S2\"], \"reason\": \"Illustrative error: invented or selectively chosen information.\"}",
          "response_sha256": "b987134991a0346e6f2392f29cfc153f639c4ff27f01a04a88efb4c6677cf878",
          "elapsed_seconds": 0.4,
          "cost_eur": 0.001,
          "output_tokens": null,
          "error": null
        },
        {
          "case_id": "U03",
          "attempt": 1,
          "status": "success",
          "response": "{\"decision\": \"review\", \"fields\": {\"supplier\": \"Birch Demo Ltd\", \"units\": 40, \"unit_price_eur\": 7.25}, \"evidence_ids\": [\"S1\"], \"reason\": \"The quote has expired at the declared reference date.\"}",
          "response_sha256": "bafc2f7c38a53c04235df33a98f33cd2919bb3c762a0d5ba59df7ea3fbfb614f",
          "elapsed_seconds": 0.4,
          "cost_eur": 0.001,
          "output_tokens": null,
          "error": null
        },
        {
          "case_id": "U03",
          "attempt": 2,
          "status": "success",
          "response": "{\"decision\": \"review\", \"fields\": {\"supplier\": \"Birch Demo Ltd\", \"units\": 40, \"unit_price_eur\": 7.25}, \"evidence_ids\": [\"S1\"], \"reason\": \"The quote has expired at the declared reference date.\"}",